{
    "$schema": "https://json-schema.org/draft/2020-12/schema",
    "$id": "https://registry.uekit.com/web/v1/schema.json",
    "title": "UEKit Web Registry",
    "type": "object",
    "additionalProperties": false,
    "required": ["schemaVersion", "name", "compatibility", "items"],
    "properties": {
        "$schema": { "type": "string" },
        "schemaVersion": { "const": 1 },
        "name": { "type": "string", "minLength": 1 },
        "homepage": { "type": "string", "format": "uri" },
        "compatibility": { "$ref": "#/$defs/compatibility" },
        "items": {
            "type": "array",
            "minItems": 1,
            "items": { "$ref": "#/$defs/item" }
        }
    },
    "$defs": {
        "compatibility": {
            "type": "object",
            "propertyNames": {
                "type": "string",
                "pattern": "^(?:node|(?:@[a-z0-9][a-z0-9._-]*/)?[a-z0-9][a-z0-9._-]*)$"
            },
            "additionalProperties": { "type": "string", "minLength": 1 }
        },
        "file": {
            "type": "object",
            "additionalProperties": false,
            "required": ["path", "target"],
            "properties": {
                "path": { "type": "string", "minLength": 1 },
                "target": { "type": "string", "minLength": 1 },
                "content": { "type": "string" },
                "hash": { "type": "string", "pattern": "^[a-f0-9]{64}$" }
            }
        },
        "item": {
            "type": "object",
            "additionalProperties": false,
            "required": ["name", "type", "version", "url", "files"],
            "properties": {
                "name": { "type": "string", "pattern": "^[a-z0-9-]+$" },
                "type": {
                    "enum": [
                        "registry:foundation",
                        "registry:ui",
                        "registry:pro",
                        "registry:layout",
                        "registry:block",
                        "registry:integration"
                    ]
                },
                "version": {
                    "type": "string",
                    "pattern": "^(0|[1-9]\\d*)\\.(0|[1-9]\\d*)\\.(0|[1-9]\\d*)(?:-[0-9A-Za-z-]+(?:\\.[0-9A-Za-z-]+)*)?(?:\\+[0-9A-Za-z-]+(?:\\.[0-9A-Za-z-]+)*)?$"
                },
                "url": {
                    "type": "string",
                    "pattern": "^items/[a-z0-9-]+/(?:0|[1-9]\\d*)\\.(?:0|[1-9]\\d*)\\.(?:0|[1-9]\\d*)(?:-[0-9A-Za-z.-]+)?(?:\\+[0-9A-Za-z.-]+)?\\.json$"
                },
                "description": { "type": "string", "minLength": 1 },
                "dependencies": {
                    "type": "array",
                    "uniqueItems": true,
                    "items": { "type": "string", "minLength": 1 }
                },
                "devDependencies": {
                    "type": "array",
                    "uniqueItems": true,
                    "items": { "type": "string", "minLength": 1 }
                },
                "registryDependencies": {
                    "type": "array",
                    "uniqueItems": true,
                    "items": { "type": "string", "pattern": "^[a-z0-9-]+$" }
                },
                "compatibility": { "$ref": "#/$defs/compatibility" },
                "files": {
                    "type": "array",
                    "minItems": 1,
                    "items": { "$ref": "#/$defs/file" }
                }
            }
        }
    }
}
